date,text
08-01-2020,japanese firms sbi and gmo join the digital gold rush in texas
09-01-2020,this company sets out to prove crypto mining has a place in your home
10-01-2020,video games giant ubisoft is looking for blockchain startups to support
11-01-2020,court gives craig wright more time to await the mysterious bonded courier
12-01-2020,institutional and retail bitcoin futures demand continues to climb
13-01-2020,close to 11 million btc haven t moved in over a year
14-01-2020,market outlook  bullish trend sends crypto prices northwards
15-01-2020,indian supreme court hears in depth arguments against rbi ban
16-01-2020,4 bitcoin mixers for the privacy conscious
17-01-2020,new stablecoins commence a fresh assault on tether
18-01-2020,new guidelines subject canadian crypto exchanges to securities laws
19-01-2020,new bill in oklahoma proposes depository for cryptocurrencies used by government
20-01-2020,maduro opens crypto casino in venezuela
21-01-2020,rbi confirms crypto not banned in india
22-01-2020,6 bankers accused of earning  30m in bonuses from german fraud  tax lawyer out on  4m bail
23-01-2020,bch script meeting aims to enhance the programming language in bitcoin cash
24-01-2020,ecb keeps subzero interest rates and open ended qe worth  20b a month but launches policy review
25-01-2020,leading swiss stock exchange offers 12 crypto exchange traded products with one that shorts bitcoin
26-01-2020,dubai launching crypto valley in tax free zone
27-01-2020,heated debate continues over bitcoin cash infrastructure funding plan
28-01-2020,international crypto exchange liquid develops perpetual btc contracts with up to 100x leverage
29-01-2020,uphold app now lets users easily trade directly between over 60 cryptos  fiat currencies and metals
30-01-2020,swiss resort town zermatt accepts bitcoin for government services
31-01-2020,hierarchies of money  why you use bank money but the bank wants reserve currency
01-02-2020,jiang zhuoer restructures development funding proposal for bitcoin cash
02-02-2020,41 german banks now charge negative interest rates
03-02-2020,coronavirus outbreak forces chinese crypto asic manufacturers to delay orders
04-02-2020,us government auctioning off bitcoins worth  37 million in 2 weeks
05-02-2020,market update  bitcoin cash shines as crypto markets show bullish signals
06-02-2020,not just ebay  nyse owner intercontinental exchange pushes bakkt to retail with latest acquisition
07-02-2020,bitcoin etfs in japan  fsa explains new rules for funds investing in cryptos
08-02-2020,cryptocurrency futures and prediction markets show trump wins the us 2020 election
09-02-2020,how to use a u2f key to secure your crypto accounts
10-02-2020,bitcoin s  10k value pushed down by cme futures price gap
11-02-2020,trump views crypto a threat  proposes countermeasures in new budget
12-02-2020,altcoin season trending   link  xtz  bstx  hbar gain up to 120  in 24h
13-02-2020,bitcoin and cryptocurrency are  like a giant garbage dumpster   says minneapolis federal reserve president
14-02-2020,bch latam  creating a viral feedback loop for mass adoption with bitcoin cash
15-02-2020,btc s market share drops consecutively for 14 days   dominance ratio slides to 60
16-02-2020,us worried crypto could undermine dollar as world reserve currency  hiring researchers to prepare response
17-02-2020,bch funding debate    founder suggests 2 3 hash vote and 6 month evaluation
18-02-2020,voluntary financing  bitcoin cash devs reveal noncustodial funding app flipstarter
19-02-2020,market update  bitcoin halving hype  golden cross signals  and gbtc s 41  premium
20-02-2020,virgin galactic stock is skyrocketing  will take bitcoin to shoot you into space
21-02-2020,coronavirus quarantine controls and shipping delays impact bitcoin miners
22-02-2020,get ready for the bitcoin halving   here are 9 countdown clocks you can monitor
23-02-2020,cryptocurrency explained on the latest episode of the simpsons
24-02-2020,us develops cryptocurrency intelligence program targeting p2p sites  forums  darknet markets
25-02-2020,wielding the tools of liberty  exploring wendy mcelroy s latest book  the satoshi revolution
26-02-2020,raising  100k for cashfusion s security audit    matches donations to improve bch privacy
27-02-2020,uk s fca suspends epayments service   over  100m frozen and alleged onecoin connection
28-02-2020,a drop in replacement for abc    bch devs release bitcoin cash node software
29-02-2020,bitcartcc s merchant solution  developer builds self hosted btcpay alternative supporting bitcoin cash
01-03-2020,cryptocurrency could kill bank lending  warns bank of england deputy governor
02-03-2020,binance users in turkey can now deposit and withdraw try via akbank integration
03-03-2020,tron s steemit acquisition exposes delegated proof of stake centralization
04-03-2020,bitcoin lawsuit  lawyers accuse craig wright of forgery  can t locate former nchain ceo
05-03-2020,the algorithms that control the cryptocurrency market
06-03-2020,htc unveils privacy protecting 5g router  pundi x finalizes blockchain phone prototype
07-03-2020,south korea passes bill to regulate cryptocurrency in line with fatf standards
08-03-2020,who is satoshi nakamoto  an introduction to bitcoin s mysterious founder
09-03-2020,empow   decentralized  visually focused social network
10-03-2020,helps crypto traders avoid costly tax mistakes
11-03-2020,judge gives craig wright new deadline   citing forgery  perjured testimony in court
12-03-2020,market update  global economy jolts bitcoin  overall crypto cap loses  50b
13-03-2020,edward snowden  felt like buying bitcoin  while traders hunt for the market bottom
14-03-2020,market update  cryptocurrency market cap sheds  90b  margin calls spike  futures slide
15-03-2020,bitcoin cash meetups go virtual in japan to combat virus  allowing members to choose
16-03-2020,bitcoin reacts to fed s 0  rate drop  reserve requirements removed   700b in stimulus
17-03-2020,analysts question gold s safe haven status   2008 data shows central banks oversaturated bullion markets
18-03-2020,us cash crisis  withdrawal limits spark bank run fear
19-03-2020,maduro orders venezuelan bank closures amid coronavirus scare
20-03-2020,market update  bulls return  120 million tethers minted  bitcoin halving looms
21-03-2020,us real estate in jeopardy   analysts predict housing market crash to 29 year lows
22-03-2020,minting basic income   us lawmaker asks treasury to issue two  1 trillion coins with no debt
23-03-2020,coindeal token   a wide range of earning possibilities
24-03-2020,notdying4wallstreet   twitter trends show people are fed up with wall street  banks and oligarchs
25-03-2020,world s largest banks losing stock value during weeks marked by pandemic
26-03-2020,what bitcoin did    scanning the hottest cryptocurrency keywords and google searches
27-03-2020,bitcoin miners are selling coins faster than they can generate them
28-03-2020,trump signs largest relief bill in us history  when will americans get stimulus checks
29-03-2020,porn industry thrives during lockdown   these sites are cryptocurrency friendly
30-03-2020,bitcoin mining roundup  btc regains 100 exahash  miners close shop  pre halving shake up
31-03-2020,us mortgage industry could collapse as housing crisis looms  experts say
01-04-2020,the many facts pointing to wei dai being satoshi
02-04-2020,tiger king s archnemesis big cat rescue accepts bitcoin
03-04-2020,homeowners can t pay  us lenders prepare for catastrophic real estate market
04-04-2020,evidence shows politicians and wall street ceos expected the market crash well before covid 19
05-04-2020,ico crackdown  11 class action lawsuits filed against cryptocurrency companies
06-04-2020,2 american banks have failed since coronavirus started spreading in the us
07-04-2020,market update  traders  buck the trend  pushing crypto market cap above  200 billion
08-04-2020,novogratz  we have money printing orgy going on  amazing environment to buy bitcoin
09-04-2020,q1 crypto trade volume jumps 61   bitcoin s price performance trumps equity and gold markets
10-04-2020,bitcoin going industrial  new york based natural gas provider sells fully compliant  hashpower contract
11-04-2020,jpmorgan  bank of america  deutsche bank predict major recession
12-04-2020,crypto exchanges see bitcoin reserves drop by 70  since black thursday s market rout
13-04-2020,ross ulbricht s 9th price analysis predicts bitcoin prices below  3 000
14-04-2020,market outlook  bitcoin s inverse head and shoulders  covid 19 fears decline  cme futures gaps
15-04-2020,google pulls 49 cryptocurrency wallet browser extensions found stealing private keys
16-04-2020,imf predicts worst global crisis since great depression  costing  9 trillion
17-04-2020,bankera launches bank account alternative focused on crypto businesses
18-04-2020,microbt reveals two next generation mining rigs with speeds up to 112 terahash
19-04-2020,largest us banks expect billions in loan losses  profits plunge
20-04-2020,america s banks can simply bail themselves out   thanks to the fed s  27 trillion blackrock deal
21-04-2020,federal reserve index  the us is already in recession
22-04-2020,petro dollar system crumbles  us dollar could collapse from the world s oil wars
23-04-2020,bitcoin to be digital gold in 2020  says bloomberg report
24-04-2020,boomer generation  in for a rude awakening   macro economist predicts  1m bitcoin by 2025
25-04-2020,is bitcoin a good investment  analyst predicts high institutional demand post covid 19
26-04-2020,bitcoin car finishes first in virtual nascar race beating national champion kyle busch
27-04-2020,economists predict great depression ii for us economy  fast or v shaped recovery unlikely
28-04-2020,bitcoin halving theories  whale says price rise is a  nonsensical narrative   weiss ratings expects  massive crypto superboom
29-04-2020,market outlook  crypto market prices rally ahead of bitcoin halving  btc up  1k in 24 hours
30-04-2020,famed economist speaks   us coronavirus bailout scam   american imperialism  de dollarization
01-05-2020,while the global economy shudders  andreessen horowitz  excited  to invest  500m into the crypto industry
02-05-2020,ecb in full on emergency mode as  unprecedented decline  hits eurozone
03-05-2020,us manufacturing crisis  fastest economic deterioration ever recorded  analyst says
04-05-2020,lebanese currency collapse  failed policies led to economic meltdown
05-05-2020,us treasury to  borrow   3 trillion for a single quarter   anticipates taking billions more for q3
06-05-2020,meet ideaology   all in one blockchain solution
07-05-2020,dollar vigilante founder talks covid 19 and economic crisis   the modern financial system is at the end of it s rope
08-05-2020,popular hedge fund manager paul tudor jones   bitcoin reminds me of gold back in 1976
09-05-2020,devon brewer  rediscovering the golden rule
10-05-2020,quantitative hardening  dissecting the third bitcoin halving  3 key data points to watch
11-05-2020,jury trial scheduled for billion dollar bitcoin lawsuit against craig wright
12-05-2020,bitcoin cash upgrade 3 days away   new opcode support  chain limit extension  sigchecks
13-05-2020,17 000 quadrigacx users seek  307m from the failed canadian crypto exchange
14-05-2020,digifinex live ama hosts   chairman   roger ver talks stimulus  useful cryptocurrencies  coronavirus
15-05-2020,bitcoin cash upgrade complete  3 new features added to consensus rules
16-05-2020,0 security breach  0 token loss
17-05-2020,45 older generation bitcoin miners are unprofitable after the reward halving
18-05-2020,mining video censored  the tale of youtube s blatant censorship and propaganda
19-05-2020,covid 19 economy fuels faith in crypto  trust in bitcoin over banks increased 3x since 2017
20-05-2020,exposure to  1x the daily performance    exchange adds inverse token btcshort
21-05-2020,no evidence isis is storing  300 million in bitcoin  says chainalysis
22-05-2020,bitcoin hashrate slides 33  since halving   difficulty drops  issues in sichuan china
23-05-2020,iranian president calls for launching a cryptocurrency mining strategy
24-05-2020,market outlook  golden cross invalidated  andreessen horowitz predicts  fourth crypto cycle
25-05-2020,over a hundred 10 year old bitcoin addresses signed  message calls  craig wright a fraud
26-05-2020,swiss government rejects  103 million bailout for crypto companies battered by coronavirus
27-05-2020,bitwage and gemini partner to launch bitcoin based retirement plan for employees
28-05-2020,grayscale  central bank digital currencies will  neither replace nor harm scarce  uncompromising bitcoin
29-05-2020,south korea to start taxing bitcoin profits in 2021
30-05-2020,american panic led to the creation and expansion of the corrupt federal reserve system
31-05-2020,amid youtube censorship  individuals flock to decentralized video sharing apps like
01-06-2020,market update  bullish bitcoin s2f chart  6 digit prices  liquidations prime crypto values
02-06-2020,us law enforcement promises  5m for the capture of venezuela s superintendent of cryptocurrencies
03-06-2020,bitcoin s flash rally to  10 400 was  fake   short the cryptocurrency  warns renowned trader bollinger
04-06-2020,chinese government crackdowns and cheap hydropower  miners migrate from north to south china
05-06-2020,the mysterious satoshi nakamoto allegedly leveraged a russian proxy for communications
06-06-2020,carl watner  the tragedy of political government
07-06-2020,bitcoin hashrate spikes to 120 exahash  difficulty drops allowing miners to rejoin the competition
08-06-2020,bitcoin s march to  100k  a number of crypto experts who believe the price per btc touches six digits
09-06-2020,over 2 000 coca cola machines now accept bitcoin in australia and new zealand
10-06-2020,a number of small bitcoin mining farms are quitting as older mining rigs become worthless
11-06-2020,speculation rife as user pays a second  2 6 million fee in ether transaction
12-06-2020,canadian regulator unveils the truth behind collapsed crypto exchange quadrigacx
13-06-2020,estonia revokes 500 crypto firms  licenses after  220 billion money laundering scandal
14-06-2020,documents show craig wright claims to own a bitcoin address with 80 000 btc stolen from mt gox
15-06-2020,youtube reinstates   official channel after suspension
16-06-2020,virtual panda btm launched for colombian residents  dispenses btc  bch  dai  and dash
17-06-2020,demand for charter cities during covid 19 pandemic grows exponential   people desire semi autonomous zones
18-06-2020,singapore based carpooling platform ryde plans to support bitcoin payments
19-06-2020,exchange announces listing of new digital asset buy by burency
20-06-2020,akon city   6 billion cryptocurrency city set to begin construction
21-06-2020,jay clayton leaves sec  crypto industry hopeful for bitcoin etf approval
22-06-2020,breaking bitcoin  crypto proponents discuss honeywell s 6 qubit quantum computer
23-06-2020,average price of bitcoin more than quadrupled between reward halvings
24-06-2020,buy stablecoins with your credit card in lumi wallet
25-06-2020,bitcoin cash fueled blogging website   raises over  100k for collective initiative
26-06-2020,online data analysis points to venezuela accepting btc for passports
27-06-2020,us real estate market crisis  4 3 million mortgage delinquencies  commercial properties sink in value
28-06-2020,federated sidechains   8m in btc stuck in limbo  analyst says action  violates liquid s security model
29-06-2020,sophisticated  hacker plunders  450 000 from defi protocol balancer
30-06-2020,60 hong kong based vending machines support mcafee s ghost token for payments
01-07-2020,brewdog tokyo accepts bitcoin cash payments  local bch meetup gathers to celebrate
02-07-2020,localbitcoins 2019 revenue rises 10  to  29 6 million amid increased paxful competition
03-07-2020,trouble in defi paradise  compound issued dai surpasses dai in circulation
04-07-2020,over 2 500 austrian merchants can now accept cryptocurrency payments
05-07-2020,bitcoin friendly kanye west running for us president 2020  taking on donald trump and joe biden
06-07-2020,700 000 expedia hotels can now be paid with cryptocurrencies via travala
07-07-2020,tiktok ban  us may join india in banning chinese social media apps
08-07-2020,permissionless software foundation aims to foster open source software with bitcoin cash
09-07-2020,avalanche launch fumbles   a highly sophisticated ddos attack derailed token sale
10-07-2020,bitcoin bull mike novogratz says to hold more gold than bitcoin
11-07-2020,fiat and money printing  street mural earns  500 in bitcoin donations in five days
12-07-2020,us dept of homeland security buys analytics software from coinbase
13-07-2020,deposition of craig wright s wife shows little understanding of bitcoin private keys
14-07-2020,advocacy group claims irs issued crypto warning letters violated taxpayer s rights
15-07-2020,investor charged in us after obtaining covid 19 relief loan to trade cryptocurrency
16-07-2020,market outlook  crypto economy sheds  10b overnight  exchange inflow and sell pressure rises
17-07-2020,report shows bitcoin s covid 19 recovery stronger than other markets with zero intervention
18-07-2020,venezuela bans bitcoin mining operations in the country s public housing sector
19-07-2020,german court rules to limit authorities  access to people s data
20-07-2020,velas enters the top 100 coinmarketcap and launches on   exchange
21-07-2020,bosagora boa  won un solidarity awards
22-07-2020,ethereum s 2020 defi boom doubles active ether addresses  but fees skyrocket
23-07-2020,steve wozniak sues youtube  google for promoting bitcoin giveaway scam   youtube denies fault
24-07-2020,veteran analyst peter brandt scorns  xrp s bag holder   compares ripple to the fed
25-07-2020,1 000 people had access to twitter  god mode    130 accounts targeted by hackers
26-07-2020,visa moving to integrate with digital currency platforms
27-07-2020,market update  cryptocurrency and gold markets fueled by failing global economy
28-07-2020,a1 telekom austria adds bitcoin to payment service for thousands of retailers
29-07-2020,crypto hardware wallet firm ledger hacked  one million customer emails exposed
30-07-2020,major investment bank oppenheimer bullish on bitcoin  highlights instead of gold
31-07-2020,chinese police take down  6 billion plustoken ponzi  arrest 109 people
01-08-2020,single miner reorgs ethereum classic   devs report a chain split
02-08-2020,india proposes amnesty for citizens holding unreported gold
03-08-2020,indians five times more likely to suffer crypto related hacks  report
04-08-2020,bitcoin atm locations reaching 9 000 worldwide
05-08-2020,bitcoin cash difficulty algorithm debate heats up with fears of another chain split
06-08-2020,5 6 million double spent  etc team finally acknowledges the 51  attack on network
07-08-2020,lumi wallet web widget  cryptocurrency exchange on your website
08-08-2020,goldman sachs cryptocurrency  possible collaboration with jpmorgan and facebook
09-08-2020,germany begins closing down all unlicensed bitcoin atms
10-08-2020,market outlook  btc trend targets  15k  bitcoin bull raoul pal  irresponsibly long
11-08-2020,peru  india  indonesia  nigeria among countries with highest crypto usage increase
12-08-2020,building the infrastructure for the future decentralized financial market  coinbase included   debut defi project   nest protocol
13-08-2020,defi implosion  yam token market cap plummets to near zero after founder claims he  failed
14-08-2020,chinese bitcoin miners develop strong relationships and crypto mining facilities in iran
15-08-2020,bitcoin and tesla  america s most loved assets on tradingview
16-08-2020,3 people arrested in hong kong for cheating bitcoin atms
17-08-2020,china testing digital currency in major cities  including beijing and hong kong
18-08-2020,excessive flooding in sichuan causes 20  hashrate losses for chinese bitcoin miners
19-08-2020,south african regulator pressures bitcoin investment company  urges clients to request refunds
20-08-2020,12 crypto firms authorized to operate license free in hawaii for two years
21-08-2020,rich dad  poor dad author says  major banking crisis coming   praises bitcoin and gold
22-08-2020,irs prioritizes cryptocurrency  now first question on 1040 tax form
23-08-2020,re mining simulation shows satoshi used a single high end pc to mine 1 1m bitcoin
24-08-2020,imf publishes cryptocurrency explainer  saying it  could be the next step in the evolution of money
25-08-2020,analysts predict us presidential election outcome could collapse dollar  boost bitcoin and gold
26-08-2020,akon joins presidential campaign of bitcoin entrepreneur brock pierce as chief strategist
27-08-2020,bitcoin will never ditch you  ad dominates front page of major hong kong newspaper
28-08-2020,bitcoin slips in latest crypto ranking by chinese government backed center
29-08-2020,after empire s exit scam  darknet market patrons scramble to find alternatives
30-08-2020,russia blocks cryptocurrency websites ahead of regulation
31-08-2020,ciphertace allegedly builds monero tracing tools  xmr proponents disagree
01-09-2020,leading stock exchanges in switzerland  germany  austria now list bitcoin etp
02-09-2020,microstrategy s  250 million bitcoin buy consequential
03-09-2020,us federal court rules nsa mass surveillance illegal  credits edward snowden
04-09-2020,market update  blood in the crypto streets  bitcoin miner dumps  cme gap  defi doldrums
05-09-2020,crypto friendly banking platform cashaa expanding in india  us  africa
06-09-2020,bitcoin dominance slides losing 10  in the last 100 days
07-09-2020,declining eth gas cost still higher than btc fees  supporters insists eth 2 0 to end high fee woe
08-09-2020,latin americans turn to bitcoin as local fiat currencies plunge
09-09-2020,ukraine  russia  south africa  nigeria among top countries by cryptocurrency adoption
10-09-2020,south african crypto exchange luno expanding globally after acquisition by digital currency group
11-09-2020,the  700 million wallet crack  bitcoin s 7th largest address is under constant attack
12-09-2020,huge  bitcoin tram  ad campaign and 20 billboards flood hong kong s financial district
13-09-2020,apple censors some cryptocurrency and defi features of coinbase app
14-09-2020,defi protocol bzx loses  8 1 million in third hack this year
15-09-2020,mad money s jim cramer  fixated  on buying bitcoin  fears massive inflation
16-09-2020,49 us states unveil unified regulation for cryptocurrency firms
17-09-2020,binance supporting flow blockchain with busd stablecoin
18-09-2020,satt smart advertising token announces listing on leading crypto exchanges  kucoin and uniswap
19-09-2020,analyst  1 500 bitcoins lost every day  less than 14 million coins will ever circulate
20-09-2020,brazen nigerian crypto scam inksnation still operational three months after regulator warning
21-09-2020,uquid launch the defi shopping stake  dss  and defito finance  dto
22-09-2020,us banks can now hold reserves for stablecoin issuers  says federal banking regulator
23-09-2020,smart advertising token satt reveals probit as next exchange listing
24-09-2020,chainlink token down 60  in under 40 days  opponents ask if the bubble has finally burst
25-09-2020,digital commodity exchange act of 2020  us lawmakers propose single national crypto framework
26-09-2020,to provide one click defi access  lists new tokens  and offers instant 0  fee visa deposits
27-09-2020,kucoin hacker leverages uniswap to dump vast number of erc20 tokens
28-09-2020,defi token exposed as pump and dump scam in leaked telegram chat
29-09-2020,new zealand tax agency asks crypto firms to hand over clients  personal data
30-09-2020,canadian firm 3iq s bitcoin fund listed on gibraltar stock exchange
01-10-2020,ico aftermath  us rules in favour of sec in  100m kik case   salt to reimburse claimants from 2017 ico
02-10-2020,with round 1 fully sold out  clintex launches round 2 of the cti token sale
03-10-2020,interest in bitcoin soars in egypt amid economic crisis and unemployment
04-10-2020,stablecoin supply doubles in 3 months as combined market cap surpasses  20b
05-10-2020,yearn finance connect  yfic  new defi project decentralized finance  staking  lending  amp  yield farming
06-10-2020,tim draper s venture studio to triple down on blockchain projects with a  25m fund
07-10-2020,p2ploan finance is all set to offer higher returns with its newly launched decentralized protocols
08-10-2020,square s major bitcoin buy  puts 1  of total assets worth  50 million in btc
09-10-2020,market update  bitcoin captures  11k  flash buy signals  bollinger band squeeze
10-10-2020,digital yuan giveaway  china s shenzhen city hands out 10 million yuan in central bank digital currency
11-10-2020,12m in  satoshi era  bitcoins move  21 block rewards from 2010 spent after a decade of slumber
12-10-2020,crypto cruise ship  satoshi  to make panama bay home
13-10-2020,ternio joins visa s fast track program as new enablement partner
14-10-2020,hong kong crypto exchange launches hardware wallet with fingerprint recognition
15-10-2020,mt gox rehabilitation plan delayed again to december 15
16-10-2020,foreign crypto exchanges like paxful  binance to pay 1 5  tax under kenya s new regulations
17-10-2020,bitcoin s creator vs  bezos  satoshi nakamoto s uphill climb to surpass the amazon founder s net worth
18-10-2020,fsb report says stablecoins promote financial inclusion  urges regulators to tighten laundering controls
19-10-2020,bitcoin bar  room 77  shuts down
