date,text
30-06-2017,blockchain releases business white paper showcasing iot enabled real world connectivity
01-07-2017,introducing the  do nothing technologies  blockchain based ico
02-07-2017,the  blockchain is for more than just btc transaction history    can help you create immutable proof of what s yours
03-07-2017,markets update  bitcoin bulls are back testing key resistance levels
04-07-2017,the decentralize your life tour  an interview with derrick broze
05-07-2017,turkey to initiate major crackdown on illegal gambling
06-07-2017,germany s largest food delivery service with 11 000  restaurants now accepts bitcoin
07-07-2017,class action lawsuit filed against cryptocurrency exchange kraken
08-07-2017,breadwallet boots up the bitcoin therapy hotline
09-07-2017,want to vote on important issues such as the block size debate  sign a statement with a non empty bitcoin address at
10-07-2017,the reason why bitcoin miners dedicate time to mining empty blocks
11-07-2017,japanese bitcoin exchange bitpoint expands into mainland china  hong kong and taiwan
12-07-2017,private swiss bank falcon group offers bitcoin asset management
13-07-2017,publicly listed south korean company building global network of cryptocurrency exchanges
14-07-2017,morgan stanley believes bitcoin acceptance is shrinking
15-07-2017,central bank of albania lists five most important bitcoin risks in public warning
16-07-2017,breadwallet s bitcoin therapy hotline exceeds expectations
17-07-2017,alphabay phisher makes  1 million in 14 months stealing bitcoins
18-07-2017,pr  cryptoping launches subscription based signal bot service
19-07-2017,counterparty experiences millionth transaction
20-07-2017,russia prepares to legalize icos
21-07-2017,markets update   bitcoin bulls are back with vigorous energy
22-07-2017,japanese exchanges to suspend services on sunday
23-07-2017,bip91 activates while fork still looms in the backdrop
24-07-2017,bollywood celebrities embrace  bitcoin
25-07-2017,what every bitcoiner should know about  bitcoin cash
26-07-2017,malta entrepreneur installs nation s first cryptocurrency atm    bitcoin  malta  fintech  blockchain  cryptocurrency
27-07-2017,fork watch  these bitcoin exchanges will not support  bitcoin cash     bitcoin
28-07-2017,markets update  bitcoin price jumps higher as protocol changes approach    bitcoin
29-07-2017,btc e domain seizure by u s  law enforcement sparks jurisdiction questions    bitcoin
30-07-2017,pr  social media is buzzing about this summer s hottest ico   karbon    bitcoin
31-07-2017,pr  former paypal exec and leading online reputation expert join monetha as ico date approaches    bitcoin
01-08-2017,fork watch  bch   the ghost in the exchange    bitcoin
02-08-2017,panel recommends indian government take immediate steps to stop bitcoin use    bitcoin
03-08-2017,despite naysayers the bitcoin cash blockchain chugs forward    bitcoin
04-08-2017,pr  atlant real estate platform    bitcoin
05-08-2017,segwit2x and the tale of three bitcoins    bitcoin
06-08-2017,pr  crypto users to invest in real estate through real platform    bitcoin
07-08-2017,bitcoin s current exchange rate is 3345 02 usd track the price of bitcoin in real time at     bitcoin  bitcoinprice
08-08-2017,new   podcast episode with jeff berwick of the dollar vigilante    bitcoin
09-08-2017,start up offers bitcoins for policing media piracy    bitcoinstartups  piracy
10-08-2017,coinbase raises  100m to  help accelerate digital currency adoption     bitcoin
11-08-2017,pr  chasyr  the uber disrupter    bitcoin
12-08-2017,lightning network wallet zap launches beta release    bitcoin
13-08-2017,inform yourself about bitcoin by visiting our getting started page  here s where to begin  it s easy     bitcoin
14-08-2017,bitcoin cash thrives during its first two weeks of life    bitcoin
15-08-2017,russia discusses starting cryptocurrency mining with its 20  gigawatt surplus    bitcoinmining  russia
16-08-2017,ukraine s new electronics declaration system is aimed at preventing corruption
17-08-2017,trezor calls an article that claims to break bitcoin hardware wallets  fud     bitcoin
18-08-2017,search volumes for bitcoin and ethereum enter inverse correlation    ethereum
19-08-2017,markets update  bitcoin cash rallies for three solid days    bitcoin
20-08-2017,pr  grab a share of 144 000 free spins in new bitstarz slot battles    bitcoin
21-08-2017,part deux  onecoin buyer beware  the definitive ponzi expos     bitcoin
22-08-2017,bitcoin   the internet of money create your wallet  buy bitcoin  read bitcoin news  and so much more at      bitcoin
23-08-2017,blockchain
24-08-2017,chinese bitcoin exchanges accused of misappropriating client funds    bitcoin
25-08-2017,bitcoin
26-08-2017,u s  pressures btc e exchange as they plan to distribute funds next month    bitcoin
27-08-2017,bank of mexico rejects  virtual currency  as legal classification for bitcoin    bitcoin
28-08-2017,pr  over 5 500 people choose to invest in atb coin    bitcoin
29-08-2017,
30-08-2017,pr  cointal  the first multi cryptocurrencies p2p marketplace launched pre signups    bitcoin
31-08-2017,
01-09-2017,f2 pool may pull hashrate support away from segwit2x    bitcoin
02-09-2017,pr  crowdsale for the smnx ico has now started    bitcoin
03-09-2017,want to vote on important issues such as the block size debate  sign a statement with a non empty bitcoin address at
04-09-2017,
05-09-2017,pr   85 942 won on dead or alive at bitstarz casino    bitcoin
06-09-2017,
07-09-2017,chinese cryptocurrency exchanges delist ico markets    bitcoin
08-09-2017,markets tumble again   how many times can china cry wolf     bitcoin
09-09-2017,ico regulatory round up  uk  malaysia  and switzerland s crypto valley point to risks    bitcoin
10-09-2017,bitcoin friendly companies enter the flying taxi business    bitcoin
11-09-2017,lead developer amaury s chet discusses the future of bitcoin cash    bitcoin
12-09-2017,pr  tokenstars launches ace token sale  early bird buyers get up to 50  purchase   40  conversion bonus    bitcoin
13-09-2017,segwit
14-09-2017,supporting multiple currencies  the price converter at   translates the  btc price into what s comfortable for you
15-09-2017,pr  online sports betting platform  betmaster announces ico campaign    bitcoin
16-09-2017,after the boss calls bitcoin a  fraud    jp morgan buys the dip    bitcoin
17-09-2017,expert  seven reasons why chinese regulators shut down bitcoin exchanges    bitcoin
18-09-2017,september s bitcoin market madness  when panic selling and fomo ensues    bitcoin
19-09-2017,is a wealth of information for bitcoiners both new and veteran  browse the threads and learn something new   bitcoin
20-09-2017,pirate bay founder s  njalla  offers anonymous domain registration for bitcoin    njalla  petersunde
21-09-2017,miningfarms  bitcoinmining
22-09-2017,russian prosecutor s office summons burger king for issuing cryptocurrency    bitcoin
23-09-2017,markets update  bitcoin price consolidates after last week s volatility    bitcoin
24-09-2017,pr  5 reasons to join afterschool crowdsale    bitcoin
25-09-2017,bitcoin software wars  the case against replay attack protection    bitcoin
26-09-2017,localbitcoins compensates users by selling bitcoin cash for btc    bitcoin
27-09-2017,sec s new cyber unit plans to combat violations involving icos    bitcoin
28-09-2017,bahrain may adopt bitcoin and issue bonds in digital currency    bitcoin
29-09-2017,ukraine cannot reach consensus on cryptocurrency   central bank explains why    bitcoin
30-09-2017,north korea accused of hacking south korean exchanges    northkorea
01-10-2017,bitcoin core developer appeals to sec regarding bit    bitcoin
02-10-2017,freetalklive
03-10-2017,decentralized exchange  airswap  gets attention in aftermath of chinese crackdown    bitcoin
04-10-2017,nigerian p2p bitcoin exchange offers services to all african nations    nigeria
05-10-2017,chinese media calls for  zero tolerance  on crimes involving cryptocurrencies    bitcoin
06-10-2017,markets update  bitcoin price pops higher but meets upper resistance    bitcoin
07-10-2017,is a wealth of information for bitcoiners both new and veteran  browse the threads and learn something new   bitcoin
08-10-2017,pr   genesis vision platform for private trust management describes an ideal ico    bitcoin
09-10-2017,bitcoin group se shares skyrocket along with bitcoin s ascent    bitcoin
10-10-2017,abu dhabi to regulate cryptocurrencies as commodities and icos as  specified investments     bitcoin
11-10-2017,pr  what s killing cryptocurrency at the point of sale and how graft can prevent it    bitcoin
12-10-2017,pr  iot start up exxor in partnership with samsung    bitcoin
13-10-2017,pr  smartbillions has created the most transparent lottery system in history    bitcoin
14-10-2017,pr  uquid ico underway   early adoption discounts still in effect    bitcoin
15-10-2017,pr  universa blockchain project ceo alexander borodich and yellowrockets are launching the world s first decentralized blockchain accelerat
16-10-2017,pr  top 50 fintech company  bankex  launches token presale    bitcoin
17-10-2017,pr  appian the world s first ethereum app store launches ico    bitcoin
18-10-2017,bitcoinfork ping
19-10-2017,gold versus bitcoin  goldman sachs prefers metal to crypto    bitcoin
20-10-2017,the price of bitcoin touches new highs reaching the  6k mark    bitcoin
21-10-2017,over  1 million in bitcoin swaps and options traded on ledgerx in its first week    bitcoin
22-10-2017,pr  aeron blockchain flight safety startup announces agreement to list aeron arn token on hitbtc    bitcoin
23-10-2017,pr  hedge token platform launched its flagship cryptocurrency index named  buchman crypto 30 index  for effective crypto trading  amp  investme
24-10-2017,pr  meet the new generation of online advertising with      bitcoin
25-10-2017,pr  smartlands   the platform for agriculture to be the first ico on stellar    bitcoin
26-10-2017,pr  jboxcoin  a blockchain based  decentrlized video streaming platform    bitcoin
27-10-2017,pr  utrust attending blockchain conferences in europe  asia and north america ahead of november 2nd ico    bitcoin
28-10-2017,satoshi revolution   chapter 2  technology meets anarchy  both profit  part 2     bitcoin
29-10-2017,pr  waste to energy blockchain company 4new raises  25 million within 8 days of presale launch    bitcoin
30-10-2017,pr  blockchain retail startup pundi x raises over usd 4 million to successfully complete pre sale ico    bitcoin
31-10-2017,pr  xenio io releases decentralized gaming blockchain source code    bitcoin
01-11-2017,pr  ethersport a blockchain based online sports lottery platform to launch ico campaign    bitcoin
02-11-2017,pr  brickblock announces ico token sale right after alpha version release    bitcoin
03-11-2017,pr  realisto announces ico to launch global crowdfunded real estate investment    bitcoin
04-11-2017,pr  serenity financial forex problems solved by blockchain    bitcoin
05-11-2017,uruguay to launch digital currency   not bitcoin  it stresses    bitcoin
06-11-2017,enterprise ireland gets fickle  funds and then backs away from cryptocurrency start ups    bitcoin
07-11-2017,ethereum wallet parity hit by second critical vulnerability    150  million frozen    bitcoin
08-11-2017,breaking news  segwit2x fork cancelled    bitcoin
09-11-2017,with segwit2x called off  crypto developers get back to work    bitcoin
10-11-2017,trump s treasury secretary   we are looking very carefully and will continue to look at  bitcoin    bitcoin
11-11-2017,sec chairman  initial coin offerings will have to register as securities    bitcoin
12-11-2017,satoshi nakamoto s confidant gavin andresen throws support behind bitcoin cash    bitcoin
13-11-2017,pr  buy gift cards with cryptocurrency  introducing gift token    bitcoin
14-11-2017,trezor announce support for bitcoin gold but other platforms steer clear    bitcoin
15-11-2017,square cash app users trial new buy and sell bitcoin feature    bitcoin
16-11-2017,putin advisor bearish on bitcoin   the cryptoruble must compete with cash     bitcoin
17-11-2017,altcoin io exchange first to launch gui atomic swap alpha wallet    bitcoin
18-11-2017,mark karpeles wants to resurrect mt gox with an ico    bitcoin
19-11-2017,the price of bitcoin exceeds  8k across global exchanges    bitcoin
20-11-2017,retirement
21-11-2017,bitcoin s current exchange rate is 8301 02 usd track the price of bitcoin in real time at      bitcoin  bitcoinprice
22-11-2017,tobam launches european bitcoin mutual fund    bitcoin
23-11-2017,paradise papers reveal bitfinex s devasini and potter established tether already back in 2014    bitcoin
24-11-2017,bitcoin exchange bitstamp gets masterpayment  cuts fees to 5     bitcoin
25-11-2017,the satoshi revolution   chapter 3  decentralized exchanges own the future  part 1     bitcoin
26-11-2017,a hacker gained access to the bitcoin gold windows wallet github    bitcoin
27-11-2017,nigerian ndic warns that cryptocurrencies lack consumer protections    bitcoin
28-11-2017,bitcoin abc developers announce medium term bitcoin cash roadmap    bitcoin
29-11-2017,this bitcoin domain can be yours for  2 75 million    bitcoin
30-11-2017,court ruling grants the irs personal data of 14 000 coinbase users    bitcoin
01-12-2017,
02-12-2017,new   podcast with crypto economist jon matonis    bitcoin
03-12-2017,coinsource adds 18 bitcoin atms in atlanta  among ten most unbanked us cities    bitcoin
04-12-2017,despite warnings china s over the counter bitcoin economy is booming    bitcoin
05-12-2017,azerbaijan
06-12-2017,over  36 million worth of bitcoin at stake in singapore s first ever crypto trial    bitcoin
07-12-2017,yahoo finance app users can now track their bitcoin balance at coinbase    bitcoin
08-12-2017,russian regulators draft law to restrict crypto mining  payments  and token sales    bitcoin
09-12-2017,the satoshi revolution   chapter 3  civil liberties and central banks  part 3     bitcoin
10-12-2017,markets update  bitcoin bounces to  15 000 amid run up to cboe futures launch    bitcoin
11-12-2017,parity calls for ethereum hard fork to reverse  230 million bug    bitcoin
12-12-2017,two days of cboe s bitcoin futures show intense volume fluctuations    bitcoin
13-12-2017,tax investigators raid bitcoin exchanges across india    bitcoin
14-12-2017,10 bitcoin apps that everyone should have    bitcoin
15-12-2017,
16-12-2017,rise of the bitcoin politician  austin peterson s scrappy run for us senate    bitcoin
17-12-2017,bitcoin gold  a case study on the cryptocurrency security problem    bitcoin
18-12-2017,more firms entering the bitcoin market see stocks soar    bitcoin
19-12-2017,nonprofits
20-12-2017,the bitcoin cash community prepares for  change the address day     bitcoin
21-12-2017,markets update  bitcoin price continues to feel bearish sentiment    bitcoin
22-12-2017,bitcoin crashes  bitcoin s dead  bitcoin s over  or is it  a brief history of deaths
23-12-2017,trading column  the writing on the wall    the art of buying the dip    bitcoin
24-12-2017,this week in bitcoin  markets wobble while fees keep soaring    bitcoin
25-12-2017,new cryptocurrency mining bot is infesting facebook messenger    bitcoin
26-12-2017,sec
27-12-2017,indian entrepreneurs rush to launch crypto companies following bitcoin boom    bitcoin
28-12-2017,cryptocurrency influencers accused of aiding pump and dumps    bitcoin
29-12-2017,trump s new tax bill means changes ahead for u s  bitcoiners    bitcoin
30-12-2017,markets update  btc value against the dollar continues to slide    bitcoin
31-12-2017,first real bitcoin lightning network payment completed via bitrefill    bitcoin
01-01-2018,happy new year  from all of us at
02-01-2018,bitcoin cash used to pay for music records  gift cards  plastic surgery    bitcoin
03-01-2018,korean lawyers take government to court over crypto regulation    bitcoin
04-01-2018,a new second layer  channel factories    bitcoin
05-01-2018,ripple dips after coinbase rejects rumors of adding new assets    bitcoin
06-01-2018,indians confused over crypto taxation   exchanges ask government to clarify    bitcoin
07-01-2018,korean government starts inspecting major banks for crypto regulation compliance    bitcoin
08-01-2018,confusion grows surrounding official chinese position regarding bitcoin mining    bitcoin
09-01-2018,fantasy market porn coin ceo ghosts  ico folds  investors lose    bitcoin
10-01-2018,miami bitcoin conference stops accepting bitcoin due to fees and congestion    bitcoin
11-01-2018,no  mainstream media  that country did not ban bitcoin  again     bitcoin
12-01-2018,strict regulations force south korean banks to stop servicing cryptocurrency exchanges    bitcoin
13-01-2018,the satoshi revolution   chapter 4  crypto  a new paradigm of privacy and id  part 2     bitcoin
14-01-2018,bitcoin cash miners process big blocks past 24h   volume approaches litecoin    bitcoin
15-01-2018,metropolitan bank ceases cryptocurrency related international wires    bitcoin
16-01-2018,cornell researchers  bitcoin not as decentralized as assumed    bitcoin
17-01-2018,crackdown on bitcoin hits businesses in bali    bitcoin
18-01-2018,south korean regulator  in reality impossible to close cryptocurrency exchanges    bitcoin
19-01-2018,bitcoin for beginners  which hardware wallet to use    bitcoin
20-01-2018,trading tip  the wall    why do we fall  bruce     bitcoin
21-01-2018,inform yourself about bitcoin by visiting our getting started page  here s where to begin  it s easy     bitcoin
22-01-2018,uk bitcoiners might have tax loophole    bitcoin
23-01-2018,markets update  cryptocurrencies try to regain strength after the recent dip    bitcoin
24-01-2018,the marketing ploys of clones  another project aims to create a  perfect bitcoin     bitcoin
25-01-2018,btc
26-01-2018,most cryptocurrencies are more centralized than you think    bitcoin
27-01-2018,australian gold refinery announces plan to develop cryptocurrency    bitcoin
28-01-2018,inform yourself about bitcoin by visiting our getting started page  here s where to begin  it s easy     bitcoin  bchpls
29-01-2018,cryptos
30-01-2018,coincheck to repay hack victims  xem balances at 81 u s  cents each    bitcoin
31-01-2018,facebook bans cryptocurrency ads    bitcoin
01-02-2018,pr  3d token ico   3d printing robots  network expansion started    bitcoin
02-02-2018,philippine sec to develop cryptocurrency regulations    bitcoin
03-02-2018,india s finance minister confirms crypto not recognized as legal tender  media panics    bitcoin
04-02-2018,markets update  long term signals suggest bullish bounce imminent for btc    bitcoin
05-02-2018,china to block access to international cryptocurrency exchanges    bitcoin
06-02-2018,senate releases testimonies ahead of crypto hearing    bitcoin
07-02-2018,forbes  inaugural crypto rich list is crass yet compelling    bitcoin
08-02-2018,markets update  cryptocurrencies start forming a well defined uptrend    bitcoin
09-02-2018,lamborghini
10-02-2018,france and germany urge discussions on crypto policy at g20 summit    bitcoin
11-02-2018,bitcoin private fork aiming to make bitcoin anonymous    bitcoin
12-02-2018,is a one stop shop for everything you need to know in the bitcoin space  join the community today     bchpls  bitcoin
13-02-2018,swap btc and bch with the   wallet s new shapeshift api    bitcoin
14-02-2018,japanese crypto investors flee capital gains taxation of up to 55     bitcoin
15-02-2018,markets update  bitcoin recovers to test  10 000 area    bitcoin
16-02-2018,atari joins growing list of old brands trying to revitalize through cryptocurrency    bitcoin
17-02-2018,bitfinex plans launch of decentralized exchange eosfinex    bitcoin
18-02-2018,switzerland enacts ico guidelines    bitcoin
19-02-2018,academics claim  crypto colonialism  rampant in puerto rico    bitcoin
20-02-2018,israeli bitcoin company sues banks for not letting it open accounts    bitcoin
21-02-2018,bafin clarifies stance on icos as more germans ask about tokens    bitcoin
22-02-2018,listen now to humans of bitcoin     this week  how migrants use bitcoin without knowing it    host   interviews luis buenaventura    amp  hugo cuevas mohr    new episodes every tues  on itunes  stitcher  soundcloud   amp  google play   hobpodcast
23-02-2018,report claims 34 000 ethereum smart contracts are vulnerable to bugs    bitcoin
24-02-2018,wendy mcelroy  privacy is the virtue that sparked the american revolution    bitcoin
25-02-2018,venezuelan government opens school to teach citizens about cryptocurrencies    bitcoin
26-02-2018,is your premier source for everything bitcoin  buy bitcoins  catch up on news  browse the forum and more    bitcoin  bchpls
27-02-2018,las vegas strippers accept bitcoin via qr tattoos    bitcoin
28-02-2018,lawyers discuss challenges posed by cryptocurrencies during divorce    bitcoin
01-03-2018,ukraine s financial watchdog clarifies stance on cryptos    bitcoin
02-03-2018,new episode today  this week in bitcoin   this week s  cryptocurrency winners  lawyers   sec subpoenas  icos  craig  satoshi  wright   sued  20k  eth returned to    vegas  sexworkers  qr code tattoos   amp   china news  host    twib
03-03-2018,rebel bitcoiners in ecuador open first crypto atms    bitcoin
04-03-2018,highly organized crime blamed for  2mil bitcoin mining burglaries    bitcoin
05-03-2018,paypal files patent for expedited cryptocurrency transaction system    bitcoin
06-03-2018,japan s sbi holdings claims 40  stake in hardware wallet company    bitcoin
07-03-2018,new episode  blockchain 2025   how  blockchain disruption in the  art industry could benefit artists  collectors  museums  galleries   amp  aficionados  hosts    amp    discuss  decentralized gallery   and more   blockchain2025  bch
08-03-2018,markets update  crypto values drop to lower vantage points    bitcoin
09-03-2018,coincheck to start compensating hack victims and resume operations next week    bitcoin
10-03-2018,75  of  20m bitcoin auction from drug busts    bitcoin
11-03-2018,pr  introducing emotiq   a next generation blockchain with powerful scalability and privacy    bitcoin
12-03-2018,dutch finance minister advocates changes to european crypto laws    bitcoin
13-03-2018,eos  cardano and tezos  sleeping giants starting to stir    bitcoin
14-03-2018,coinbase granted e money license by uk s financial conduct authority    bitcoin
15-03-2018,three south korean crypto exchanges raided for diverting funds    bitcoin
16-03-2018,france warns of 15 unauthorized cryptocurrency investment platforms    bitcoin
17-03-2018,pr  the man who sold his house for bitcoin has joined the moneytoken advisory board    bitcoin
18-03-2018,markets update  bears pull crypto prices near last bottom    bitcoin
19-03-2018,israeli crypto companies banned from stock exchange indices    bitcoin
20-03-2018,pr  wbf    blockchain set to heat up dubai     bitcoin
21-03-2018,twitter and square ceo jack dorsey  bitcoin to be world s currency    bitcoin
22-03-2018,here are 7 crypto comparison sites chasing coinmarketcap s crown    bitcoin
23-03-2018,pr  bitcoin miner distributor blokforge opens us retail location    bitcoin
24-03-2018,pr  etherspin   the gambling platform ico for long term investors    bitcoin
25-03-2018,pr  waste to energy platform 4new to implement ocular kyc solution before completing crowdfunding sale    bitcoin
26-03-2018,pr  deep aero s drone token pre sale starts on 30 march  2018    bitcoin
27-03-2018,pr  ubank launches blockchain   based platform to enable mass consumer investment in cryptocurrency    bitcoin
28-03-2018,cryptoads
29-03-2018,pr  decentralized messenger echt tokens listed on yobit and tidex exchanges    bitcoin
30-03-2018,pr  chandler guo joins education ecosystem liveedu as advisor     bitcoin
31-03-2018,russians owe 13  tax on their crypto incomes    bitcoin
01-04-2018,ny legal firm launches cryptocurrency litigation tracker    bitcoin
02-04-2018,pr  pablo escobar s brother sells out ico round 1 of dietbitcoin  ddx  cryptocurrency in just 1 week  starts ico round 2    bitcoin
03-04-2018,never miss any critical bitcoin related news again with this easy guide    bitcoin
04-04-2018,venezuela to use the petro to buy auto parts from russia    bitcoin
05-04-2018,emin g n sirer discusses cryptocurrency academics and proof of stake    bitcoin
06-04-2018,crypto self regulation deemed likely in south africa    bitcoin
07-04-2018,private digital money  better than state issued  swiss central banker says    bitcoin
08-04-2018,supporting multiple currencies  the price converter at   translates the  btc price into what s comfortable for you   bchpls
09-04-2018,pr  nimses   crypto that pays you for your time    bitcoin
10-04-2018,missed friday s this week in bitcoin   download  amp  subscribe now for the l d on     that 51  attack    vitalik buterin vs craig wright    chinese mules  amp  otc    serial scammers busted in bangkok    get all that  amp  more       w  your host
11-04-2018,corporations bypassing korean ico regulations with overseas subsidiaries    bitcoin
12-04-2018,malta succeeds in attracting another cryptocurrency exchange  okex    bitcoin
13-04-2018,yahoo  japan confirms entrance into the crypto space    bitcoin
14-04-2018,here s lowdown on what s happened in the world of bitcoin this week   chinese communists adopt the blockchain  amp  jpmorgan chase is being sued   listen to  thisweekinbitcoin podcast to find out why now       bitcoin  bitcoinpodcastnetwork
